{
  "webhookEvent": "jira:issue_created",
  "timestamp": 1700000000000,
  "issue": {
    "id": "10002",
    "key": "DEMO-8",
    "fields": {
      "summary": "New issue from webhook",
      "status": { "name": "To Do" },
      "issuetype": { "name": "Task" },
      "reporter": { "displayName": "Bob" }
    }
  },
  "user": { "displayName": "Bob" }
}
